video_id,video_title,view_count,channel_name,channel_id,channel_url,time_record,video_tag
Dd_uvpdhonc,Sahur Kalian!!!,497,ShinMei,UCahetHoMuR0j0EKLogexCIg,/@ShinMeii,2024-03-18 23:32:23.757362,[]
vZ96jD3jh1Q,Kenapa Eropa Pro LGBT banget? Padahal Dulu Paling Anti! Lupa Tragedi Masa Lalu? | LearningByGoogling,81295,Sepulang Sekolah,UCfQHaUbD0oEBH_FRYHE5qIg,/@SepulangSekolah,2024-03-18 23:32:23.757362,"['sepulang sekolah', 'koi', 'jui', 'SMA', 'pelajar', 'komedi', 'comedy', 'standup', 'web series', 'bogor', 'indonesia', 'belajar', 'learning by googling', 'learning by google', 'learning with google', 'koide', 'koide namizo', 'koiyocabe', 'koiyo cabe', 'koyocabe', 'koyo cabe', 'history', 'sejarah', 'budaya', 'culture', 'asia tenggara', 'south east asia', 'story telling', 'storytelling', 'penjelasan', 'eropa', 'pelangi', 'raindow', 'index rainbow', 'rainbows', 'index']"
8mEAAeDIH6w,The Apothecary diaries,36,tisuki_kun,UCkwCdZ9YWdzw7cQZMQ6i0zA,/@haruko_cha,2024-03-18 23:32:23.757362,[]
yM9nzbzJNec,Sousou no Frieren Ep. 27 Emotional OST- Flower Field | COVER,7117,TaeIn Kim Music,UCO-CX5f2TOpRxeoi0Xi9C1A,/channel/UCO-CX5f2TOpRxeoi0Xi9C1A,2024-03-18 23:32:23.757362,"['sousou', 'sousou no frieren', 'frieren', 'frieren ost', 'sousou no frieren emotional ost', 'emotional ost', 'frieren emotional ost', 'frieren sad ost', 'frieren sad music', 'sousou no frieren 27', 'episode 27']"
k-Wk_hm2Aa4,"Kronologi lengkap, Kejanggalan & Teori2 menghilangnya KATE MIDDLETON. | #NERROR",253206,Nessie Judge,UC_SBt2BFBkExq_azj-P5lNA,/@NessieJudge,2024-03-18 23:32:23.757362,"['indonesian', 'vlog', 'vlogger', 'youtuber', 'nessie', 'judge', 'nessiejudge', 'nerror', 'teorikonspirasi', 'horror']"
MfSE956GpUE,The Apothecary Diaries OP/Opening  - Hana ni Natte,980924,AniClipsCollection,UCCCFdfIWVMZt2Gb6kjrj4QA,/@accytofficial,2024-03-18 23:32:23.757362,[]
WRa-38EDrZA,Shangri-La Frontier: Pemburu Gim Ampas Menjajal Gim Dewa - Episode 23 [Takarir Indonesia],321265,Muse Indonesia,UCxxnxya_32jcKj4yN1_kD7A,/@MuseIndonesia,2024-03-18 23:32:23.757362,"['シャンフロ', '日高里菜', '千本木彩花', 'Fantasy', 'Drama', 'isekai', 'komedi', 'muse', 'anime', 'Streaming', 'DiRumahAja']"
1h1w876eIAo,MENDING AZKA KATOLIK SELAMANYA DARIPADA DEKET SAMA ONAD‼️- LOGIN - JAFAR - ONAD,786908,Deddy Corbuzier,UCYk4LJI0Pr6RBDWowMm-KUw,/@corbuzier,2024-03-18 23:32:23.757362,"['Login', 'Log in', 'Habib Jafar', 'Onad', 'Onadio Leonardo', 'Closethedoor', 'Login di closethedoor', 'Agama', 'Islam', 'Ramadhan', 'Lucu', 'Debat', 'Sahur', 'buka puasa', 'puasa', 'tarawih', 'Komedi', 'Comedy', 'Deddy Corbuzier', 'Corbuzier', 'Orang tua', 'religi', 'islam', 'kristen', 'muslim', 'gereja', 'anak', 'nada tarina', 'azka corbuzier', 'ibu', 'surga', 'neraka']"
qHCVG5xQgwc,Learn Japanese with Fern | Frieren: Beyond Journey's End | Fern blocks Zoltraak,73989,Learn Japanese with Anime,UC9ssvo21riZqIWx6dLyzUNg,/@LearnJapanesewithJasmine,2024-03-18 23:32:23.757362,[]
9tYgQjZ9Dbc,Mind Blown! A Game of Cat and Wolf? - The Apothecary Diaries: ep 23,192,Clockwork Dandy Noodles,UC-_cRrsoxa069cC_bDFdfUw,/@ClockworkDandyNoodles,2024-03-18 23:32:23.757362,"['The Apothecary Diaries', 'The Apothecary Diaries reviews', 'The Apothecary Dairies analysis', 'seasonal anime', 'fall anime 2023', 'fall anime 2023 review', 'fall anime 2023 reaction', 'fall anime 2023 analysis', 'anime breakdowns', 'anime reactions', 'anime reviews', 'anime', 'clockwork dandy noodles', 'the apothecary diaries reviews', 'the apothecary diaries reactions', 'the apothecary diaries episode 23 reaction', 'the apothecary diaries episode 23 review']"
gpLkELOOSkQ,Semua episode Tanpa Sadar Levelku Mentok Setelah Membasmi Slime Selama 300 Tahun [Takarir Indonesia],456621,Muse ID Best Anime Collection,UCjcAfwNEjkXA352e2uMt5Jg,/@museidbestanimecollection,2024-03-18 23:32:23.757362,"['Slime', 'Slime300', 'Azusa', 'Beelzebub', 'Laika', 'YuukiAoi', 'HondoKaede', 'OzawaAri', 'SquareEnix', 'Bushiroad', 'Dmm', 'DirumahAja', 'Muse', 'Gratis', 'Isekai']"
D7bnoDIPs4M,Pentingnya belajar fisika di sekolah... Biar ga kayak gini 😭😭,115862,Fajrul Fx,UCUYgCukQfUN2DImPYrBiV4g,/@FajrulFx,2024-03-18 23:32:23.757362,"['Fajrul Fx', 'sains', 'indonesia', 'fisika']"
08Wrjft4KsU,"Xpander Nabrak Porsche 9Milyar, Caleg Kena Clickbait & Tes Adrenalin",92679,TnM,UCZdmuthWjKAC-oiaoh1bfOw,/@andriTNM,2024-03-18 23:32:23.757362,"['TNM', 'Podcast', 'lunatictwister', 'Viral', 'Trending', 'Viral di Indonesia', 'Indonesia', 'Berita', 'Info', 'Misuh']"
4MaW5380DjU,EPISODE 129: SADIEZS❗️ DIJADIKAN SESAJEN SETAN OLEH TEMAN❗️,391830,Dokter Stephanie,UCNylyhNWG_zKB2yw0l6nl9g,/@dokterstephanie,2024-03-18 23:32:23.757362,"['Forensik', 'Forensic', 'Forensics', 'Otopsi', 'Autopsy', 'Kisah Otopsi', 'Kisah Forensik', 'Kisah Forensik Dokter Stephanie', 'Kisah Otopsi Dokter Stephanie', 'Misteri', 'Cerita Misteri', 'Cerita Horor', 'Horor', 'Horror', 'Medis', 'Misterius', 'Sosok Gaib', 'Mistis', 'Cerita Mistis', 'Cerita Mistik', 'Cerita Forensik', 'Cerita Otopsi', 'Cerita Dari Ruang Otopsi', 'Satanic', 'Tumbal', 'Pemuja Setan']"
YV0SfVzcV1w,"PWK - SUDAH BELAJAR PUASA, SHOLAT, DAN PUNYA KTP ISLAM, INI ALASAN DENNY SUMARGO BELUM LOG IN!!",2515641,HAS Creative,UCio3ArXLJ_Mo8FLLGVzIC5A,/@HASCreative,2024-03-18 23:32:23.757362,"['pwk', 'podcast warung', 'warung kopi', 'yanti', 'praz teguh', 'BBEG', 'komika', 'stand up comedy', 'suci', 'Has Creative', 'PWK', 'Podcast Warung Kopi', 'Yanti', 'Yanti Pwk', 'PrazYanti', 'Maling', 'Talkjil', 'Denny Sumargo', 'denny sumargo podcast', 'denny sumargo klarifikasi', 'denny sumargo istri', 'olivia allan', 'curhat bang denny sumargo', 'denny sumargo pwk', 'denny sumargo yanti', 'densu', 'denny sumargo praz teguh', 'denny sumargo ellyas pical', 'denny sumargo basket', 'pembasket sombong', 'denny sumargo aktor', 'lucu', 'kocak', 'komedi']"
ZaFIYKKkH3g,Ini yang Katanya Anime Komedi Paling Lucu? - Grand Blue,13901,Megane Sensei,UC6Yoq_MyO8-nkrvCj7USqzw,/@MeganeSensei,2024-03-18 23:32:23.757362,"['Overlord', 'Detail Kecil', 'Megane Sensei', 'Grand Blue', 'Grand Blue Season 2', 'Iori', 'Chisa', 'Aina', 'Kouhei']"
FxJ3zPUU6Y4,Lofi study 🍃 Music that makes u more inspired to study & work - Chill beats ~ study / stress relief,2276668,Little Soul,UCdTB4hMadQoqVaDiunBIkmQ,/@little_soul,2024-03-18 23:32:23.757362,"['chill instrumental beats', 'lofi', 'study mix', 'lofi hip hop', 'chillhop', 'chill beats', 'lofi radio', 'chill study beats', 'lo fi hip hop', 'chill relax beats', 'beats to study to', 'chillhop records', 'lo-fi beats', 'chillhop essentials', 'study music', 'study beats', 'jazzhop', 'lofi beats', 'relax sleep', 'relax study', 'focus music', 'focusing music for studying', 'beats to relax study to', 'little soul', 'lofi hip hop mix', 'music that makes u more inspired to study and work', 'little soul lofi', 'lofi study music']"
QZFlIpCyhr4,Tenzin's Biggest Freak Outs Ever 🤯 | The Legend of Korra,1314705,Avatar: The Last Airbender,UCN_u5w69V9wUZYG8WeJWuNg,/@TeamAvatar,2024-03-18 23:32:23.757362,"['nickelodeon', 'animation', 'anime', 'avatar', 'avatar the last airbender', 'atla', 'avatar on netflix', 'netflix', 'the last airbender', 'aang', 'toph', 'team avatar', 'avatar studios', 'zuko', 'toph beifong', 'full episode', 'full episodes', 'live action', 'netflix avatar', 'avatar the last airbender netflix', 'netflix avatar the last airbender', 'avatar netflix', 'avatar netflix trailer', 'avatar netflix clip', 'avatar netflix live action', 'avatar netflix cast', 'daniel dae kim', 'katara', 'azula', 'Gordon Cormier', 'Ian Ousley', 'animated']"
